Date,SentimentScore,Sentiment,Review,SentimentNum
9/1/2013,0.06433566433566432,Positive,"I Live in Los Angeles, since we get a great cut from the Salon we went back to get our hair buzzed for a vacation.  All the way from Los Angeles.  Luis did a great job, but the girl.  She didn't hear a word I said about how I wanted my hair cut.  By the time she turned me around for me to see myself in the mirror, it was to late.  She cut my hair so short.  It was exactly what I didn't want to have happen.  There was no turning back.  All you could do was keep going shorter.  It was the worst start to long planned vacation of a lifetime.  I have to go on my vacation looking like a Chemo patient.  Apologies for example, but it best describes the slaughter that is my haircut.  If you see this Blond Girl run, run as fast as you can.  She is a massacre waiting to happen.  gain, What a horrible way to start my vacation.",0
4/12/2014,0.266521164021164,Positive,"I came here a few days ago, and the choice was made because my regular stylist moved so because of the great reviews on yelp i decided to give it a try, luis cut my hair and did a fantastic job, i always felt barbers would be great with the clippers and not so much with the scissors but luis was fantastic with both, took my time and i felt very relaxed for it being my first time, my hair was longer, and he had to take his time i wanted it a little shorter and all i have to say is i would def recommend this place to anyone, mike is the other barber and owner and although he did not cut my hair im quite sure he is good as well, great location atmosphere, i am an honest reviewer and i will only write reviews if something is really good or really bad, do not see the point for anything in between, it would not seem helpful, i highly recommend this place, both guys are very cool also and down to earth.....",0
7/26/2012,1.0,Positive,"Everytime I am vacationing in CA, I take time to go see Ernie and get a haircut.  I wish I could find a barber like Ernie in NJ!Best haircut and conversation, he is the best!",0
3/16/2010,0.35540674603174605,Positive,"I went here today during my lunch break on my quest to find that perfect 'main street' barber shop. All I can say is my search is over. Ernie did a GREAT job, making sure I received the best quality haircut and beard trim. He cleaned me up nice too; straight razor to the neck line and beard line, a little aftershave and hair tonic on the head).I walked in and felt right at home, while I read a magazine and waited for a chair to open. All in all by the time I walked in and out was 20 min.I will DEFINITELY be adding coming here to my weekly routine.   NOTE: They are closed from noon-1PM for lunch.",0
9/3/2014,0.13201754385964912,Positive,"The first time I went to the shop I got great service and was impressed with the work.  The second time, I took my 11 year-old son with the intent that we would both get our hair cut.  The man who cut my hair the first time wasn't there this time.  My son went first as only one chair was empty.  The other chair was soon empty and instead of being greeted by the barber that was just freed up, he proceed to lay back on the barber chair and immerse himself in his phone, as if I wasn't there.  Then I noticed there was a wall of Playboy magazines, which is completely inappropriate.  Finally, the women working on my son's hair, which only took 5 minutes, charged me a full $20.  If they had any chance of getting my business again, they might have considered giving me a break for such a quick job.  That is the last $20 they will receive from me.  Needless to say, no tip was forthcoming.",0
1/11/2012,0.16361111111111112,Positive,"My boyfriend and I just moved to California from Boston (he's from France) so when he needed a haircut I searched Yelp for reviews. Main Street Barber came up and since it was really close, we decided to give it a try. This was my boyfriend's first time at a barber shop since they don't have them in France so he was a little skeptical. However, Mike the Barber was amazing! He was very personable and friendly and even offered us free drinks. I LOVE my boyfriend's haircut. It's a much cleaner and styled cut than he usually gets from salons. We don't need to look any further for a barber, we will definitely be frequent customers. Thanks Mike!",0
5/13/2012,0.2484307359307359,Positive,"After trying 3 other barbers, I found Mike at his old 2nd St shop. His new shop is awesome. If there's a bit of a wait, you don't care. It's that kind of place. Cold beer, sports on the TV, this is a man's barber shop and the conversation is good. No matter what kind of day you're having you leave feeling better about things.I've recently relocated to North Carolina, tried a couple shops over there, it didn't go so well. Fortunately I travel back to LA/OC for work and when I do I make time to go to the Main Street Barber Shop.",0
6/6/2014,0.2736111111111111,Positive,"close enough to walk to, very convenient.  Even so, I'd still rate 5 stars if I had to hunt for parking.  Friendly yet professional and always a nice clean job.",0
3/21/2012,0.2916666666666667,Positive,"Great haircut for $20, he even cleans you up in the back with the hot foam and straight razor. Not to mention you can have a beer from his tap while you wait. Can it get better? The answer, my friends, is no. Go here. Enough said.",0
2/20/2011,0.2138888888888889,Positive,"I drive from Long Beach to Seal Beach to get my hair cut because I always enjoy the jovial atmosphere at the Main St. Barber, 317 1/2 Main St.   Two barbers, and no parking meters to pay.   Always available parking somewhere close.   Reasonable barber rates.   It's a pleasure to go there.    Le Bron Preston",0
6/18/2011,0.013055555555555574,Positive,"Earnie was very good and nice on my first visit.  I gave him a big tip, and he wasw very pleased.  The second visit was like the barber from hell!!  Earnie was very sort, in abig hurry to finish me so would only give the sides a trim.  When I asked him if he would shorten the top, he replied that yhou could only remove so much.  In his nasty comentary, he suggested that his bad attitude was from drinking earlier.  Worst hair cut in many years!  Nasty attitude!  I will not be back!  What a jerk!",0
